{
  "matrixVersion": "0.3.0",
  "contextContractVersion": "1.0.0",
  "requestContractVersion": "1.1.0",
  "designDnaSchemaVersion": "0.3.0",
  "auditContractVersion": "2.0.0",
  "epistemicStatuses": ["observed", "inferred", "proposed", "unknown"],
  "tokenCategories": [
    "color",
    "space",
    "size",
    "typography",
    "radius",
    "border",
    "elevation",
    "opacity",
    "layer",
    "motion",
    "iconography",
    "data-visualization",
    "asset",
    "other"
  ],
  "ruleCategories": [
    "layout",
    "typography",
    "color",
    "content",
    "component",
    "state",
    "interaction",
    "navigation",
    "form",
    "data-display",
    "visualization",
    "responsive",
    "platform",
    "accessibility",
    "localization",
    "performance",
    "trust",
    "ethics",
    "motion",
    "media",
    "governance"
  ],
  "axes": [
    {
      "id": "axis.spatial-composition",
      "order": 1,
      "name": "Spatial composition and layout system",
      "purpose": "Formalize regions, containment, grids, alignment, rhythm, density, hierarchy, and depth as reusable spatial relationships.",
      "promptRef": "prompts/02-spatial-composition.md",
      "focusAreas": [
        "Regions and containment",
        "Grid, columns, and containers",
        "Spacing and vertical rhythm",
        "Alignment and proportion",
        "Density, depth, and salience"
      ],
      "facets": [
        {
          "id": "facet.spatial.regions-containment",
          "name": "Regions and containment",
          "question": "Which regions, containers, boundaries, and nesting levels organize the interface?",
          "inspect": [
            "page, shell, section, panel, card, inset, and overlay boundaries",
            "container ownership, edge behavior, and nesting depth",
            "full-bleed, bounded, sticky, fixed, and scrollable regions"
          ],
          "screenshotLimits": [
            "a crop does not establish the full page boundary",
            "a static frame does not prove sticky, fixed, or scroll ownership"
          ]
        },
        {
          "id": "facet.spatial.grid-columns",
          "name": "Grid, columns, and containers",
          "question": "Which repeated tracks, gutters, margins, spans, and container relationships explain the visible geometry?",
          "inspect": [
            "column count, span relationships, gutters, and outer margins",
            "nested grids, repeated tracks, and alignment anchors",
            "content width, readable width, and local overflow regions"
          ],
          "screenshotLimits": [
            "exact grid measurements cannot be recovered from scaled pixels alone",
            "one viewport does not establish breakpoint-specific tracks"
          ]
        },
        {
          "id": "facet.spatial.spacing-rhythm",
          "name": "Spacing and vertical rhythm",
          "question": "Which gap families and repetition ratios distinguish related, grouped, and separate content?",
          "inspect": [
            "intra-control, intra-component, inter-component, section, and page gaps",
            "repeated spacing families and exceptional gaps",
            "baseline rhythm, row rhythm, and whitespace distribution"
          ],
          "screenshotLimits": [
            "visual estimates do not prove exact token values",
            "empty content can imitate intentional whitespace"
          ]
        },
        {
          "id": "facet.spatial.alignment-proportion",
          "name": "Alignment and proportion",
          "question": "Which geometric and optical alignments create order and balance?",
          "inspect": [
            "edge, center, baseline, decimal, icon, and optical alignment",
            "dominant-to-supporting region proportions",
            "aspect ratios and repeated geometry"
          ],
          "screenshotLimits": [
            "optical alignment is an interpretation unless repeated evidence supports it",
            "cropping can distort apparent proportion"
          ]
        },
        {
          "id": "facet.spatial.density-depth-hierarchy",
          "name": "Density, depth, and salience",
          "question": "How do whitespace, scale, contrast, depth, and repetition establish perceptual priority?",
          "inspect": [
            "information density and control density by region",
            "salience tiers, focal anchors, and quiet zones",
            "surface layering, overlap, elevation, and depth cues"
          ],
          "screenshotLimits": [
            "prominence does not prove product priority or usage frequency",
            "a screenshot cannot prove dynamic elevation or scroll behavior"
          ]
        }
      ],
      "conceptRefs": [
        "concept.spatial-system",
        "concept.surface-depth-hierarchy",
        "concept.information-hierarchy",
        "concept.content-layout-resilience",
        "concept.semantic-responsive-reflow",
        "concept.visual-stability"
      ]
    },
    {
      "id": "axis.typography-content-hierarchy",
      "order": 2,
      "name": "Typography and content hierarchy",
      "purpose": "Extract role-based type relationships, readability constraints, numeric treatment, and content behavior without guessing font identity.",
      "promptRef": "prompts/03-typography-content-hierarchy.md",
      "focusAreas": [
        "Type roles and scale",
        "Metrics and readability",
        "Emphasis and semantic hierarchy",
        "Numerals and data typography",
        "Text overflow and language resilience"
      ],
      "facets": [
        {
          "id": "facet.type.roles-scale",
          "name": "Type roles and scale",
          "question": "Which semantic text roles exist and how are their sizes and weights related?",
          "inspect": [
            "display, page title, section title, component title, body, label, metadata, caption, code, and data roles",
            "relative size, weight, contrast, and spacing hierarchy",
            "role reuse and intentional exceptions",
            "apparent glyph width, geometric or humanist character, x-height cues and numeral shape; exact font identity remains unknown"
          ],
          "screenshotLimits": [
            "font family and exact metrics cannot be identified from resemblance",
            "a single sample does not establish a complete modular scale"
          ]
        },
        {
          "id": "facet.type.metrics-readability",
          "name": "Metrics and readability",
          "question": "Which relationships among size, line height, measure, tracking, and paragraph spacing preserve readability?",
          "inspect": [
            "line-height-to-size relationships and text block measure",
            "tracking, word spacing, paragraph rhythm, and dense-label treatment",
            "readability floors and proposed calibration bounds"
          ],
          "screenshotLimits": [
            "computed metrics require implementation evidence",
            "visual sharpness is affected by capture scale and compression"
          ]
        },
        {
          "id": "facet.type.emphasis-hierarchy",
          "name": "Emphasis and semantic hierarchy",
          "question": "How do weight, color, case, decoration, and placement distinguish importance and meaning?",
          "inspect": [
            "strong, subtle, interactive, warning, success, disabled, and placeholder text",
            "capitalization, sentence case, title case, underlining, and emphasis patterns",
            "heading continuity and label-value relationships"
          ],
          "screenshotLimits": [
            "visual hierarchy does not establish semantic heading levels",
            "color alone cannot establish text meaning"
          ]
        },
        {
          "id": "facet.type.numerals-data",
          "name": "Numerals and data typography",
          "question": "How are values, units, signs, decimals, percentages, currencies, dates, and comparisons formatted and aligned?",
          "inspect": [
            "tabular versus proportional alignment cues",
            "unit placement, precision, signs, abbreviations, and large-number formatting",
            "value, context, comparison, and timeframe hierarchy"
          ],
          "screenshotLimits": [
            "glyph feature support cannot be proven from pixels",
            "one locale does not establish alternate number or date formats"
          ]
        },
        {
          "id": "facet.type.overflow-localization",
          "name": "Text overflow and language resilience",
          "question": "How should text survive wrapping, clamping, long words, expansion, alternate scripts, and bidirectionality?",
          "inspect": [
            "visible wrap, clamp, ellipsis, and growth zones",
            "label and value collision risks",
            "script, locale, RTL, and enlarged-text implications"
          ],
          "screenshotLimits": [
            "short text does not prove an overflow policy",
            "unseen scripts and directions remain proposed or unknown"
          ]
        }
      ],
      "conceptRefs": [
        "concept.typographic-system",
        "concept.information-hierarchy",
        "concept.data-comparison-context",
        "concept.content-layout-resilience",
        "concept.localization-bidirectionality",
        "concept.content-voice-comprehension"
      ]
    },
    {
      "id": "axis.color-surface-identity",
      "order": 3,
      "name": "Color, surfaces, assets, and visual identity",
      "purpose": "Extract semantic color relationships, surface hierarchy, shape language, iconography, imagery, and brand expression.",
      "promptRef": "prompts/04-color-surface-identity.md",
      "focusAreas": [
        "Semantic color roles",
        "Surfaces and depth",
        "Theme and contrast modes",
        "Iconography, imagery, and illustration",